term_name,definition,definition_source,definition_source_text,definition_source_link,related_terms,canonical_uri,widoco_link,source_version,source_timestamp,query_checksum
Age-at-maturity,The age when salmon become sexually mature adults. Influenced by genetics and environment.,"Van Beveren, E. (2024). Revision of Catch- and Maturity- at Age Used to Assess the Northern Contingent of Atlantic Mackerel (Scomber scombrus). DFO Can. Sci. Advis. Sec. Res. Doc. 2024/012. iv + 28 p.","Van Beveren, E. (2024). Revision of Catch- and Maturity- at Age Used to Assess the Northern Contingent of Atlantic Mackerel (Scomber scombrus). DFO Can. Sci. Advis. Sec. Res. Doc. 2024/012. iv + 28 p.",,Observed rate or abundance (subClassOf) [https://w3id.org/dfoc/salmon#ObservedRateOrAbundance],https://w3id.org/dfoc/salmon#AgeAtMaturity,https://w3id.org/dfoc/salmon/widoco/index.html#AgeAtMaturity,5865432c5b56e85c1c18aa8f818882954710c03b,2025-11-25T20:10:14.898446+00:00,a8ea9b668ad185e1185206af16fd643b9e8c88a790df4de394667b3c0efd02e7
Conservation Unit status-based limit reference point,Stock Management Unit (SMU)-level limit reference points (LRPs) based on the status of component Wild Salmon Policy (WSP) Conservation Units (CUs) recommended to meet requirements of the Fisheries Act.,DFO. (2022). Methodologies and Guidelines for Defining Limit Reference Points for Pacific Salmon. DFO Can. Sci. Advis. Sec. Sci. Advis. Rep. 2022/030. (Erratum: December 2022),DFO. (2022). Methodologies and Guidelines for Defining Limit Reference Points for Pacific Salmon. DFO Can. Sci. Advis. Sec. Sci. Advis. Rep. 2022/030. (Erratum: December 2022),,Reference point (subClassOf) [https://w3id.org/dfoc/salmon#ReferencePoint],https://w3id.org/dfoc/salmon#CUStatusBasedLRP,https://w3id.org/dfoc/salmon/widoco/index.html#CUStatusBasedLRP,5865432c5b56e85c1c18aa8f818882954710c03b,2025-11-25T20:10:14.898446+00:00,a8ea9b668ad185e1185206af16fd643b9e8c88a790df4de394667b3c0efd02e7
Exploitation rate,"Expressed as a percentage, the proportion of the total return of adult salmon in a given year that die (harvested or removed) as a result of fishing activity. ER = total fishing mortality / (total fishing mortality + escapement)",Fisheries and Oceans Canada. (2019). Government of Canada. Pacific Salmon - Glossary. https://www.pac.dfo-mpo.gc.ca/fm-gp/salmon-saumon/gloss-eng.html. [Accessed 09-10-2025] ,Fisheries and Oceans Canada. (2019). Government of Canada. Pacific Salmon - Glossary. https://www.pac.dfo-mpo.gc.ca/fm-gp/salmon-saumon/gloss-eng.html. [Accessed 09-10-2025] ,,Target or limit rate or abundance (subClassOf) [https://w3id.org/dfoc/salmon#TargetOrLimitRateOrAbundance],https://w3id.org/dfoc/salmon#ExploitationRate,https://w3id.org/dfoc/salmon/widoco/index.html#ExploitationRate,5865432c5b56e85c1c18aa8f818882954710c03b,2025-11-25T20:10:14.898446+00:00,a8ea9b668ad185e1185206af16fd643b9e8c88a790df4de394667b3c0efd02e7
Exploitation rate at Maximum Sustainable Yield,The exploitation rate associated with the maximum sustainable yield (MSY). Usually expressed as an annual proportion. Exploitation rate is synonymous with harvest rate (U).,"Marentette, J. R., Kronlund, A. R., & Cogliati, K. M. (2021). Specification of Precautionary Approach Reference Points and Harvest Control Rules in Domestically Managed and Assessed Key Harvested Stocks In Canada. DFO Can. Sci. Advis. Sec. Res. Doc. 2021/057. vii + 98 p.","Marentette, J. R., Kronlund, A. R., & Cogliati, K. M. (2021). Specification of Precautionary Approach Reference Points and Harvest Control Rules in Domestically Managed and Assessed Key Harvested Stocks In Canada. DFO Can. Sci. Advis. Sec. Res. Doc. 2021/057. vii + 98 p.",,Target or limit rate or abundance (subClassOf) [https://w3id.org/dfoc/salmon#TargetOrLimitRateOrAbundance],https://w3id.org/dfoc/salmon#UMSY,https://w3id.org/dfoc/salmon/widoco/index.html#UMSY,5865432c5b56e85c1c18aa8f818882954710c03b,2025-11-25T20:10:14.898446+00:00,a8ea9b668ad185e1185206af16fd643b9e8c88a790df4de394667b3c0efd02e7
Fishery reference point,"A benchmark against which the biomass or abundance of the stock or the fishing mortality rate (or exploitation rate) can be measured in order to determine its status. These reference points can be targets, thresholds or limits depending on their intended use.","Marentette, J. R., Kronlund, A. R., & Cogliati, K. M. (2021). Specification of Precautionary Approach Reference Points and Harvest Control Rules in Domestically Managed and Assessed Key Harvested Stocks In Canada. DFO Can. Sci. Advis. Sec. Res. Doc. 2021/057. vii + 98 p.","Marentette, J. R., Kronlund, A. R., & Cogliati, K. M. (2021). Specification of Precautionary Approach Reference Points and Harvest Control Rules in Domestically Managed and Assessed Key Harvested Stocks In Canada. DFO Can. Sci. Advis. Sec. Res. Doc. 2021/057. vii + 98 p.",,Reference point (subClassOf) [https://w3id.org/dfoc/salmon#ReferencePoint],https://w3id.org/dfoc/salmon#FisheryReferencePoint,https://w3id.org/dfoc/salmon/widoco/index.html#FisheryReferencePoint,5865432c5b56e85c1c18aa8f818882954710c03b,2025-11-25T20:10:14.898446+00:00,a8ea9b668ad185e1185206af16fd643b9e8c88a790df4de394667b3c0efd02e7
Fishing mortality,"Measure of deaths in a stock due to all fishing activities, including: targeted fishing, bycatch and discards, other incidental mortality in other fisheries.",Fisheries and Oceans Canada. (2024). Introduction to Stock Assessment - Glossary. https://www.dfo-mpo.gc.ca/science/species-especes/fisheries-halieutiques/assessment-evaluation/glossary-glossaire/index-eng.html. [Accessed 09-10-2025].,Fisheries and Oceans Canada. (2024). Introduction to Stock Assessment - Glossary. https://www.dfo-mpo.gc.ca/science/species-especes/fisheries-halieutiques/assessment-evaluation/glossary-glossaire/index-eng.html. [Accessed 09-10-2025].,,Observed rate or abundance (subClassOf) [https://w3id.org/dfoc/salmon#ObservedRateOrAbundance],https://w3id.org/dfoc/salmon#FishingMortality,https://w3id.org/dfoc/salmon/widoco/index.html#FishingMortality,5865432c5b56e85c1c18aa8f818882954710c03b,2025-11-25T20:10:14.898446+00:00,a8ea9b668ad185e1185206af16fd643b9e8c88a790df4de394667b3c0efd02e7
Index-based,"Index-based management procedures (MPs), in general, adjust the catch based on changes in a population index over time.","Huynh, Q.C., Siegle, M.R., and Haggarty, D.R. 2025. Application of the Management Procedure Framework for Outside Quillback Rockfsh (Sebastes maliger ) in British Columbia in 2021. DFO Can. Sci. Advis. Sec. Res. Doc. 2024/028. iv + 201 p.","Huynh, Q.C., Siegle, M.R., and Haggarty, D.R. 2025. Application of the Management Procedure Framework for Outside Quillback Rockfsh (Sebastes maliger ) in British Columbia in 2021. DFO Can. Sci. Advis. Sec. Res. Doc. 2024/028. iv + 201 p.",,information content entity (subClassOf) [http://purl.obolibrary.org/obo/IAO_0000030],https://w3id.org/dfoc/salmon#IndexBased,https://w3id.org/dfoc/salmon/widoco/index.html#IndexBased,5865432c5b56e85c1c18aa8f818882954710c03b,2025-11-25T20:10:14.898446+00:00,a8ea9b668ad185e1185206af16fd643b9e8c88a790df4de394667b3c0efd02e7
Indicator,A derived assessment index used in Fisheries Science Reports or stock status reporting.,,,,Index-based (subClassOf) [https://w3id.org/dfoc/salmon#IndexBased],https://w3id.org/dfoc/salmon#Indicator,https://w3id.org/dfoc/salmon/widoco/index.html#Indicator,5865432c5b56e85c1c18aa8f818882954710c03b,2025-11-25T20:10:14.898446+00:00,a8ea9b668ad185e1185206af16fd643b9e8c88a790df4de394667b3c0efd02e7
Limit reference point,"A fish stock experiencing serious harm may be depleted to the point where it has impaired productivity or reproductive capacity. As a result, the stock would be less resilient to fishing and could not easily rebuild. Serious harm may be irreversible, or only slowly reversible over the long-term, and can be due to fishing, other human-induced impacts, or natural causes. Under the Precautionary Approach policy and the Fish Stocks Provisions (FSPs), breaching the LRP is a trigger for a rebuilding plan.",Fisheries and Oceans Canada. (2024). Introduction to Stock Assessment - Glossary. https://www.dfo-mpo.gc.ca/science/species-especes/fisheries-halieutiques/assessment-evaluation/glossary-glossaire/index-eng.html. [Accessed 09-10-2025].,Fisheries and Oceans Canada. (2024). Introduction to Stock Assessment - Glossary. https://www.dfo-mpo.gc.ca/science/species-especes/fisheries-halieutiques/assessment-evaluation/glossary-glossaire/index-eng.html. [Accessed 09-10-2025].,,Reference point (subClassOf) [https://w3id.org/dfoc/salmon#ReferencePoint],https://w3id.org/dfoc/salmon#LimitReferencePoint,https://w3id.org/dfoc/salmon/widoco/index.html#LimitReferencePoint,5865432c5b56e85c1c18aa8f818882954710c03b,2025-11-25T20:10:14.898446+00:00,a8ea9b668ad185e1185206af16fd643b9e8c88a790df4de394667b3c0efd02e7
Marine survival,Marine survival is defined as the portion of the coded-wire tagged smolt release that has survived to be either caught in marine fisheries or returned to freshwater as adult.,Fisheries and Oceans Canada. (2025). 2024 Marine Survival Forecast of Southern British Columbia Coho. 17 p.,Fisheries and Oceans Canada. (2025). 2024 Marine Survival Forecast of Southern British Columbia Coho. 17 p.,,Indicator (subClassOf) [https://w3id.org/dfoc/salmon#Indicator],https://w3id.org/dfoc/salmon#MarineSurvival,https://w3id.org/dfoc/salmon/widoco/index.html#MarineSurvival,5865432c5b56e85c1c18aa8f818882954710c03b,2025-11-25T20:10:14.898446+00:00,a8ea9b668ad185e1185206af16fd643b9e8c88a790df4de394667b3c0efd02e7
Maximum sustainable yield,The largest catch (yield) that can be taken on average from a population under existing environmental conditions. Catch will vary annually due to variation in a populations survival rate.,Fisheries and Oceans Canada. (2005). Canada's Policy for Conservation of Wild Pacific Salmon. Retrieved from https://waves-vagues.dfo-mpo.gc.ca/library-bibliotheque/315577.pdf.,Fisheries and Oceans Canada. (2005). Canada's Policy for Conservation of Wild Pacific Salmon. Retrieved from https://waves-vagues.dfo-mpo.gc.ca/library-bibliotheque/315577.pdf.,,Target or limit rate or abundance (subClassOf) [https://w3id.org/dfoc/salmon#TargetOrLimitRateOrAbundance],https://w3id.org/dfoc/salmon#MaximumSustainableYield,https://w3id.org/dfoc/salmon/widoco/index.html#MaximumSustainableYield,5865432c5b56e85c1c18aa8f818882954710c03b,2025-11-25T20:10:14.898446+00:00,a8ea9b668ad185e1185206af16fd643b9e8c88a790df4de394667b3c0efd02e7
Observed rate or abundance,"A measurement datum representing an empirically observed rate, count, or abundance derived from monitoring or survey data.",,,,measurement datum (subClassOf) [http://purl.obolibrary.org/obo/IAO_0000109],https://w3id.org/dfoc/salmon#ObservedRateOrAbundance,https://w3id.org/dfoc/salmon/widoco/index.html#ObservedRateOrAbundance,5865432c5b56e85c1c18aa8f818882954710c03b,2025-11-25T20:10:14.898446+00:00,a8ea9b668ad185e1185206af16fd643b9e8c88a790df4de394667b3c0efd02e7
Percent of hatchery origin spawners,"Percent of salmon spawning in the natural environment that were reared in a hatchery and are first generation hatchery fish. Contrast with Natural origin spawners (not reared in a hatchery, but could be second generation hatchery) or wild salmon with no hatchery lineage.","Pacific Marine Conservation Caucus, Salmon Subcommittee. (2022). Mark Selective Fisheries and Mass Marking under the Pacific Salmon Strategy Initiative: Comments and Feedback on Proposed Expansion. Pacific Marine Conservation Caucus Salmon Subcommittee. Available at https://www.mccpacific.org/wp-content/uploads/2022/10/MCC-Salmon-Subcommittee-Comments-on-DFOs-MM-and-MSF-Discussion-Paper-220930.pdf.","Pacific Marine Conservation Caucus, Salmon Subcommittee. (2022). Mark Selective Fisheries and Mass Marking under the Pacific Salmon Strategy Initiative: Comments and Feedback on Proposed Expansion. Pacific Marine Conservation Caucus Salmon Subcommittee. Available at https://www.mccpacific.org/wp-content/uploads/2022/10/MCC-Salmon-Subcommittee-Comments-on-DFOs-MM-and-MSF-Discussion-Paper-220930.pdf.",,Observed rate or abundance (subClassOf) [https://w3id.org/dfoc/salmon#ObservedRateOrAbundance],https://w3id.org/dfoc/salmon#PercentHatcheryOriginSpawners,https://w3id.org/dfoc/salmon/widoco/index.html#PercentHatcheryOriginSpawners,5865432c5b56e85c1c18aa8f818882954710c03b,2025-11-25T20:10:14.898446+00:00,a8ea9b668ad185e1185206af16fd643b9e8c88a790df4de394667b3c0efd02e7
Reference point,Reference points are used as targets to achieve or as limits to avoid.,Fisheries and Oceans Canada. (2024). Introduction to stock assessment. Available at https://www.dfo-mpo.gc.ca/science/species-especes/fisheries-halieutiques/assessment-evaluation/module-1/11-eng.html [Accessed 09-10-2025].,Fisheries and Oceans Canada. (2024). Introduction to stock assessment. Available at https://www.dfo-mpo.gc.ca/science/species-especes/fisheries-halieutiques/assessment-evaluation/module-1/11-eng.html [Accessed 09-10-2025].,,information content entity (subClassOf) [http://purl.obolibrary.org/obo/IAO_0000030],https://w3id.org/dfoc/salmon#ReferencePoint,https://w3id.org/dfoc/salmon/widoco/index.html#ReferencePoint,5865432c5b56e85c1c18aa8f818882954710c03b,2025-11-25T20:10:14.898446+00:00,a8ea9b668ad185e1185206af16fd643b9e8c88a790df4de394667b3c0efd02e7
Removal rate,The ratio of all human induced removals and total exploitable stock size.,"Forrest, R. E., Holt, K. R., & Kronlund, A. R. (2018). Performance of alternative harvest control rules for two Pacific groundfish stocks with uncertain natural mortality: Bias, robustness and trade-offs. Fisheries Research, 206, p. 259-286.","Forrest, R. E., Holt, K. R., & Kronlund, A. R. (2018). Performance of alternative harvest control rules for two Pacific groundfish stocks with uncertain natural mortality: Bias, robustness and trade-offs. Fisheries Research, 206, p. 259-286.",,Indicator (subClassOf) [https://w3id.org/dfoc/salmon#Indicator]; measurement datum (subClassOf) [http://purl.obolibrary.org/obo/IAO_0000109],https://w3id.org/dfoc/salmon#RemovalRate,https://w3id.org/dfoc/salmon/widoco/index.html#RemovalRate,5865432c5b56e85c1c18aa8f818882954710c03b,2025-11-25T20:10:14.898446+00:00,a8ea9b668ad185e1185206af16fd643b9e8c88a790df4de394667b3c0efd02e7
Removal reference,"Removal reference is the maximum removal rate of a fish stock. It is less than or equal to the stock's maximum sustainable yield. It can be expressed in terms of fishing mortality, harvest rate, and fishing effort.",Fisheries and Oceans Canada. (2024). Introduction to Stock Assessment - Glossary. https://www.dfo-mpo.gc.ca/science/species-especes/fisheries-halieutiques/assessment-evaluation/glossary-glossaire/index-eng.html. [Accessed 09-10-2025].,Fisheries and Oceans Canada. (2024). Introduction to Stock Assessment - Glossary. https://www.dfo-mpo.gc.ca/science/species-especes/fisheries-halieutiques/assessment-evaluation/glossary-glossaire/index-eng.html. [Accessed 09-10-2025].,,Target or limit rate or abundance (subClassOf) [https://w3id.org/dfoc/salmon#TargetOrLimitRateOrAbundance],https://w3id.org/dfoc/salmon#RemovalReference,https://w3id.org/dfoc/salmon/widoco/index.html#RemovalReference,5865432c5b56e85c1c18aa8f818882954710c03b,2025-11-25T20:10:14.898446+00:00,a8ea9b668ad185e1185206af16fd643b9e8c88a790df4de394667b3c0efd02e7
Spawning biomass at Maximum Sustainable Yield,The predicted number of spawners producing maximum sustained yield. It is a key biological reference point used in fisheries management and benchmark under the Wild Salmon Policy to maintain fish populations at sustainable levels.,"Parken, C. K., McNicol, R. E., & Irvine, J. R. (2006). Habitat-based methods to estimate escapement goals for data limited Chinook salmon stocks in British Columbia, 2004. Canadian Science Advisory Secretariat Research Document 2006/083. Ottawa, Ontario, Canada.","Parken, C. K., McNicol, R. E., & Irvine, J. R. (2006). Habitat-based methods to estimate escapement goals for data limited Chinook salmon stocks in British Columbia, 2004. Canadian Science Advisory Secretariat Research Document 2006/083. Ottawa, Ontario, Canada.",,Target or limit rate or abundance (subClassOf) [https://w3id.org/dfoc/salmon#TargetOrLimitRateOrAbundance],https://w3id.org/dfoc/salmon#SMSY,https://w3id.org/dfoc/salmon/widoco/index.html#SMSY,5865432c5b56e85c1c18aa8f818882954710c03b,2025-11-25T20:10:14.898446+00:00,a8ea9b668ad185e1185206af16fd643b9e8c88a790df4de394667b3c0efd02e7
Spawning biomass in one generation,Spawner abundance that will result in recovery to SMSY in one generation in the absence of fishing under equilibrium conditions.,"Holt, C. A. (2009). Evaluation of benchmarks for conservation units in Canada’s Wild Salmon Policy: Technical Documentation. DFO Can. Sci. Advis. Sec. Res. Doc. 2009/059. x + 50 p.","Holt, C. A. (2009). Evaluation of benchmarks for conservation units in Canada’s Wild Salmon Policy: Technical Documentation. DFO Can. Sci. Advis. Sec. Res. Doc. 2009/059. x + 50 p.",,Target or limit rate or abundance (subClassOf) [https://w3id.org/dfoc/salmon#TargetOrLimitRateOrAbundance],https://w3id.org/dfoc/salmon#Sgen,https://w3id.org/dfoc/salmon/widoco/index.html#Sgen,5865432c5b56e85c1c18aa8f818882954710c03b,2025-11-25T20:10:14.898446+00:00,a8ea9b668ad185e1185206af16fd643b9e8c88a790df4de394667b3c0efd02e7
Target or limit rate or abundance,"A value specification representing a policy- or model-defined target or limit, such as TAC, UMSY, or reference points.",,,,measurement datum (subClassOf) [http://purl.obolibrary.org/obo/IAO_0000109],https://w3id.org/dfoc/salmon#TargetOrLimitRateOrAbundance,https://w3id.org/dfoc/salmon/widoco/index.html#TargetOrLimitRateOrAbundance,5865432c5b56e85c1c18aa8f818882954710c03b,2025-11-25T20:10:14.898446+00:00,a8ea9b668ad185e1185206af16fd643b9e8c88a790df4de394667b3c0efd02e7
Target reference point,"The overall stock level target. It is determined by setting productivity, broader ecological, and socio-economic objectives for the fishery. It is typically set at or above the USR.",Fisheries and Oceans Canada. (2024). Introduction to stock assessment. Available at https://www.dfo-mpo.gc.ca/science/species-especes/fisheries-halieutiques/assessment-evaluation/module-1/11-eng.html [Accessed 09-10-2025].,Fisheries and Oceans Canada. (2024). Introduction to stock assessment. Available at https://www.dfo-mpo.gc.ca/science/species-especes/fisheries-halieutiques/assessment-evaluation/module-1/11-eng.html [Accessed 09-10-2025].,,Reference point (subClassOf) [https://w3id.org/dfoc/salmon#ReferencePoint],https://w3id.org/dfoc/salmon#TargetReferencePoint,https://w3id.org/dfoc/salmon/widoco/index.html#TargetReferencePoint,5865432c5b56e85c1c18aa8f818882954710c03b,2025-11-25T20:10:14.898446+00:00,a8ea9b668ad185e1185206af16fd643b9e8c88a790df4de394667b3c0efd02e7
Total allowable catch,A policy-defined catch limit set for a particular fishery within a specified management period. Also referred to as quota.,Fisheries and Oceans Canada. (2024). Introduction to Stock Assessment - Glossary. https://www.dfo-mpo.gc.ca/science/species-especes/fisheries-halieutiques/assessment-evaluation/glossary-glossaire/index-eng.html. [Accessed 09-10-2025].,Fisheries and Oceans Canada. (2024). Introduction to Stock Assessment - Glossary. https://www.dfo-mpo.gc.ca/science/species-especes/fisheries-halieutiques/assessment-evaluation/glossary-glossaire/index-eng.html. [Accessed 09-10-2025].,,Target or limit rate or abundance (subClassOf) [https://w3id.org/dfoc/salmon#TargetOrLimitRateOrAbundance],https://w3id.org/dfoc/salmon#TotalAllowableCatch,https://w3id.org/dfoc/salmon/widoco/index.html#TotalAllowableCatch,5865432c5b56e85c1c18aa8f818882954710c03b,2025-11-25T20:10:14.898446+00:00,a8ea9b668ad185e1185206af16fd643b9e8c88a790df4de394667b3c0efd02e7
Upper stock reference,A threshold below which fishing must be reduced to avoid reaching the LRP. The USR must be set at an appropriate distance above the LRP to provide sufficient opportunity for managers to recognize a declining stock status and sufficient time for management actions to take effect. ,Fisheries and Oceans Canada. (2024). Introduction to Stock Assessment - Glossary. https://www.dfo-mpo.gc.ca/science/species-especes/fisheries-halieutiques/assessment-evaluation/glossary-glossaire/index-eng.html. [Accessed 09-10-2025].,Fisheries and Oceans Canada. (2024). Introduction to Stock Assessment - Glossary. https://www.dfo-mpo.gc.ca/science/species-especes/fisheries-halieutiques/assessment-evaluation/glossary-glossaire/index-eng.html. [Accessed 09-10-2025].,,Reference point (subClassOf) [https://w3id.org/dfoc/salmon#ReferencePoint],https://w3id.org/dfoc/salmon#UpperStockReferencePoint,https://w3id.org/dfoc/salmon/widoco/index.html#UpperStockReferencePoint,5865432c5b56e85c1c18aa8f818882954710c03b,2025-11-25T20:10:14.898446+00:00,a8ea9b668ad185e1185206af16fd643b9e8c88a790df4de394667b3c0efd02e7
