term_name,definition,definition_source,definition_source_text,definition_source_link,related_terms,canonical_uri,widoco_link,source_version,source_timestamp,query_checksum
"Type-6, Presence or Absence","Non-numeric, year-specific record of presence/not detected (i.e., present/absent without estimating a count), tied to an explicit time and location, with reliable species identification. Underlying field methods may be highly variable; analysis is not required.",,,,Escapement Estimate Type Scheme (inScheme) [https://w3id.org/gcdfo/salmon#EstimateTypeScheme]; Estimate Type (broader) [https://w3id.org/gcdfo/salmon#EstimateType],https://w3id.org/gcdfo/salmon#Type6,https://dfo-pacific-science.github.io/dfo-salmon-ontology/#Type6,243fa9b201bb4ae77778d85ccbb43e6ab4b18e73,2026-02-17T19:15:17.399367+00:00,ce035e857bdc28834fdf9736f63f5f606341675ce16f75a9c1cbb69b3076d0be
Upper benchmark,"An upper-threshold benchmark value, typically delineating the boundary between Amber and Green status zones.",,,,Benchmark Level Scheme (inScheme) [https://w3id.org/gcdfo/salmon#BenchmarkLevelScheme],https://w3id.org/gcdfo/salmon#UpperBenchmark,https://dfo-pacific-science.github.io/dfo-salmon-ontology/#UpperBenchmark,243fa9b201bb4ae77778d85ccbb43e6ab4b18e73,2026-02-17T19:15:17.399367+00:00,ce035e857bdc28834fdf9736f63f5f606341675ce16f75a9c1cbb69b3076d0be
Upper biological benchmark,Upper benchmark value for a metric used to delineate Wild Salmon Policy status zones (typically the boundary between Amber and Green zones).,Fisheries and Oceans Canada. (2021). Wild Salmon Policy 2018-2022 Implementation Plan. Available at https://waves-vagues.dfo-mpo.gc.ca/library-bibliotheque/40728109.pdf.,Fisheries and Oceans Canada. (2021). Wild Salmon Policy 2018-2022 Implementation Plan. Available at https://waves-vagues.dfo-mpo.gc.ca/library-bibliotheque/40728109.pdf.,https://waves-vagues.dfo-mpo.gc.ca/library-bibliotheque/40728109.pdf,Metric benchmark (subClassOf) [https://w3id.org/gcdfo/salmon#MetricBenchmark],https://w3id.org/gcdfo/salmon#UpperBiologicalBenchmark,https://dfo-pacific-science.github.io/dfo-salmon-ontology/#UpperBiologicalBenchmark,243fa9b201bb4ae77778d85ccbb43e6ab4b18e73,2026-02-17T19:15:17.399367+00:00,ce035e857bdc28834fdf9736f63f5f606341675ce16f75a9c1cbb69b3076d0be
Upper stock reference,A threshold below which fishing must be reduced to avoid reaching the LRP. The USR must be set at an appropriate distance above the LRP to provide sufficient opportunity for managers to recognize a declining stock status and sufficient time for management actions to take effect. ,DFO Introduction to Stock Assessment Glossary.,DFO Introduction to Stock Assessment Glossary.,,Reference point (subClassOf) [https://w3id.org/gcdfo/salmon#ReferencePoint],https://w3id.org/gcdfo/salmon#UpperStockReferencePoint,https://dfo-pacific-science.github.io/dfo-salmon-ontology/#UpperStockReferencePoint,243fa9b201bb4ae77778d85ccbb43e6ab4b18e73,2026-02-17T19:15:17.399367+00:00,ce035e857bdc28834fdf9736f63f5f606341675ce16f75a9c1cbb69b3076d0be
Uptime,Counting/device uptime < 95% (or <90% with interpolation),,,,Downgrade Criteria (broader) [https://w3id.org/gcdfo/salmon#DowngradeCriteria]; Downgrade Criteria Scheme (inScheme) [https://w3id.org/gcdfo/salmon#DowngradeCriteriaScheme],https://w3id.org/gcdfo/salmon#Uptime,https://dfo-pacific-science.github.io/dfo-salmon-ontology/#Uptime,243fa9b201bb4ae77778d85ccbb43e6ab4b18e73,2026-02-17T19:15:17.399367+00:00,ce035e857bdc28834fdf9736f63f5f606341675ce16f75a9c1cbb69b3076d0be
Visibility,Poor visibility conditions,,,,Downgrade Criteria (broader) [https://w3id.org/gcdfo/salmon#DowngradeCriteria]; Downgrade Criteria Scheme (inScheme) [https://w3id.org/gcdfo/salmon#DowngradeCriteriaScheme],https://w3id.org/gcdfo/salmon#Visibility,https://dfo-pacific-science.github.io/dfo-salmon-ontology/#Visibility,243fa9b201bb4ae77778d85ccbb43e6ab4b18e73,2026-02-17T19:15:17.399367+00:00,ce035e857bdc28834fdf9736f63f5f606341675ce16f75a9c1cbb69b3076d0be
Visual Ground Count,"Visual surveys conducted by stream/bank walk with documented visit schedule, reach coverage, timing, and visibility conditions.",,,,Enumeration Method (broader) [https://w3id.org/gcdfo/salmon#EnumerationMethod]; Escapement Enumeration Method Scheme (inScheme) [https://w3id.org/gcdfo/salmon#EnumerationMethodScheme],https://w3id.org/gcdfo/salmon#VisualGroundCount,https://dfo-pacific-science.github.io/dfo-salmon-ontology/#VisualGroundCount,243fa9b201bb4ae77778d85ccbb43e6ab4b18e73,2026-02-17T19:15:17.399367+00:00,ce035e857bdc28834fdf9736f63f5f606341675ce16f75a9c1cbb69b3076d0be
Visual Snorkel Count,"Two or more trained snorkelers conduct standardized passes within defined segments, tallying live/dead by species. Field forms capture visibility class, segment boundaries, and repeat-visit schedule; counts are aggregated across observers/passes.",,,,Enumeration Method (broader) [https://w3id.org/gcdfo/salmon#EnumerationMethod]; Escapement Enumeration Method Scheme (inScheme) [https://w3id.org/gcdfo/salmon#EnumerationMethodScheme],https://w3id.org/gcdfo/salmon#VisualSnorkelCount,https://dfo-pacific-science.github.io/dfo-salmon-ontology/#VisualSnorkelCount,243fa9b201bb4ae77778d85ccbb43e6ab4b18e73,2026-02-17T19:15:17.399367+00:00,ce035e857bdc28834fdf9736f63f5f606341675ce16f75a9c1cbb69b3076d0be
Wild Salmon Policy,"Canada's Wild Salmon Policy framework for conserving and managing wild Pacific salmon, including integrated status assessments and biological benchmarks for Conservation Units.",,,,Policy framework (broader) [https://w3id.org/gcdfo/salmon#PolicyFramework]; Policy framework scheme (inScheme) [https://w3id.org/gcdfo/salmon#PolicyFrameworkScheme],https://w3id.org/gcdfo/salmon#WildSalmonPolicy,https://dfo-pacific-science.github.io/dfo-salmon-ontology/#WildSalmonPolicy,243fa9b201bb4ae77778d85ccbb43e6ab4b18e73,2026-02-17T19:15:17.399367+00:00,ce035e857bdc28834fdf9736f63f5f606341675ce16f75a9c1cbb69b3076d0be
Wild Salmon Policy biological status zone,"The biological status of a Conservation Unit (CU) will normally be based on the abundance and distribution of spawners in the unit, or proxies thereof. For each CU, higher and lower benchmarks will be defined that will delimit three status zones: Green, Amber, and Red. As spawner abundance decreases, a CU moves towards the lower status zone, and the extent of management intervention for conservation purposes will increase.",Fisheries and Oceans Canada. (2021). Wild Salmon Policy 2018-2022 Implementation Plan. Available at https://waves-vagues.dfo-mpo.gc.ca/library-bibliotheque/40728109.pdf.,Fisheries and Oceans Canada. (2021). Wild Salmon Policy 2018-2022 Implementation Plan. Available at https://waves-vagues.dfo-mpo.gc.ca/library-bibliotheque/40728109.pdf.,,Wild Salmon Policy Status Zone (inScheme) [https://w3id.org/gcdfo/salmon#WSPBiologicalStatusZoneScheme],https://w3id.org/gcdfo/salmon#WSPBiologicalStatusZone,https://dfo-pacific-science.github.io/dfo-salmon-ontology/#WSPBiologicalStatusZone,243fa9b201bb4ae77778d85ccbb43e6ab4b18e73,2026-02-17T19:15:17.399367+00:00,ce035e857bdc28834fdf9736f63f5f606341675ce16f75a9c1cbb69b3076d0be
Wild Salmon Policy Status Zone,Controlled vocabulary for biological status zones under the Wild Salmon Policy.,,,,,https://w3id.org/gcdfo/salmon#WSPBiologicalStatusZoneScheme,https://dfo-pacific-science.github.io/dfo-salmon-ontology/#WSPBiologicalStatusZoneScheme,243fa9b201bb4ae77778d85ccbb43e6ab4b18e73,2026-02-17T19:15:17.399367+00:00,ce035e857bdc28834fdf9736f63f5f606341675ce16f75a9c1cbb69b3076d0be
WSP rapid status,"The WSP rapid status assessment approach builds on previously completed WSP integrated status assessments. The WSP rapid status approach ensures statuses are scientifically objective, consistent, and comparable across BC/Yukon CUs. This approach is also relatively easy to implement, applicable to data rich and data poor CUs, and can be updated annually.","Pestal, G., MacDonald, B. L., Grant, S. C. H., and Holt, C. A. (2023). State of the Salmon: rapid status assessment approach for Pacific salmon under Canada’s Wild Salmon Policy. Can. Tech. Rep. Fish. Aquat. Sci. 3570: xiv + 200 p.","Pestal, G., MacDonald, B. L., Grant, S. C. H., and Holt, C. A. (2023). State of the Salmon: rapid status assessment approach for Pacific salmon under Canada’s Wild Salmon Policy. Can. Tech. Rep. Fish. Aquat. Sci. 3570: xiv + 200 p.",,,https://w3id.org/gcdfo/salmon#WSPRapidStatus,https://dfo-pacific-science.github.io/dfo-salmon-ontology/#WSPRapidStatus,243fa9b201bb4ae77778d85ccbb43e6ab4b18e73,2026-02-17T19:15:17.399367+00:00,ce035e857bdc28834fdf9736f63f5f606341675ce16f75a9c1cbb69b3076d0be
WSP Rapid Status Algorithm threshold,Threshold value used by the rapid-status algorithm that may differ from expert-defined benchmarks to incorporate precautionary buffers.,DFO (2024). Rapid Status Approximations for Pacific Salmon Derived from Integrated Expert Assessments under Canada’s Wild Salmon Policy. CSAS Science Response 2024/004.,DFO (2024). Rapid Status Approximations for Pacific Salmon Derived from Integrated Expert Assessments under Canada’s Wild Salmon Policy. CSAS Science Response 2024/004.,https://www.dfo-mpo.gc.ca/csas-sccs/Publications/ScR-RS/2024/2024_004-eng.pdf,information content entity (subClassOf) [http://purl.obolibrary.org/obo/IAO_0000030],https://w3id.org/gcdfo/salmon#WSPRapidStatusAlgorithmThreshold,https://dfo-pacific-science.github.io/dfo-salmon-ontology/#WSPRapidStatusAlgorithmThreshold,243fa9b201bb4ae77778d85ccbb43e6ab4b18e73,2026-02-17T19:15:17.399367+00:00,ce035e857bdc28834fdf9736f63f5f606341675ce16f75a9c1cbb69b3076d0be
Year basis,"A year-based temporal reference used to contextualize measurements or rates (e.g., brood year or catch year).",,,,,https://w3id.org/gcdfo/salmon#YearBasis,https://dfo-pacific-science.github.io/dfo-salmon-ontology/#YearBasis,243fa9b201bb4ae77778d85ccbb43e6ab4b18e73,2026-02-17T19:15:17.399367+00:00,ce035e857bdc28834fdf9736f63f5f606341675ce16f75a9c1cbb69b3076d0be
